{
  "$schema": "https://json-schema.org/draft/2020-12/schema",
  "$id": "https://example.invalid/mapf/mapf-problem.schema.json",
  "title": "MapfProblem v1",
  "type": "object",
  "additionalProperties": false,
  "required": [
    "map",
    "robots",
    "objective",
    "time_model"
  ],
  "properties": {
    "schema_version": {
      "const": "mapf-problem/1.0"
    },
    "id": {
      "type": "string",
      "minLength": 1
    },
    "created_at": {
      "type": "string",
      "format": "date-time"
    },
    "map": {
      "type": "object",
      "additionalProperties": false,
      "anyOf": [
        {
          "required": [
            "cells"
          ]
        },
        {
          "required": [
            "width",
            "height"
          ]
        }
      ],
      "properties": {
        "cells": {
          "type": "array",
          "minItems": 1,
          "items": {
            "type": "string",
            "minLength": 1
          }
        },
        "width": {
          "type": "integer",
          "minimum": 1
        },
        "height": {
          "type": "integer",
          "minimum": 1
        },
        "blocked": {
          "type": "array",
          "items": {
            "type": "array",
            "minItems": 2,
            "maxItems": 2,
            "items": {
              "type": "integer",
              "minimum": 0
            },
            "description": "[x, y]，x 向右、y 向下，原点左上"
          }
        },
        "coordinates": {
          "enum": [
            "grid-corner",
            "center-origin"
          ]
        }
      }
    },
    "time_model": {
      "type": "object",
      "additionalProperties": false,
      "required": [
        "horizon"
      ],
      "properties": {
        "timestep": {
          "const": "discrete"
        },
        "horizon": {
          "anyOf": [
            {
              "type": "integer",
              "minimum": 1
            },
            {
              "const": "auto"
            }
          ]
        }
      }
    },
    "movement": {
      "type": "object",
      "additionalProperties": false,
      "properties": {
        "neighbors": {
          "enum": [
            "4+wait",
            "4+wait+sync"
          ]
        },
        "sync": {
          "const": "synchronous"
        },
        "wait_action": {
          "type": "boolean"
        },
        "diagonal": {
          "type": "boolean"
        }
      }
    },
    "robots": {
      "type": "array",
      "minItems": 1,
      "items": {
        "type": "object",
        "additionalProperties": false,
        "required": [
          "id",
          "start",
          "goal"
        ],
        "properties": {
          "id": {
            "type": "string",
            "minLength": 1
          },
          "start": {
            "type": "array",
            "minItems": 2,
            "maxItems": 2,
            "items": {
              "type": "integer",
              "minimum": 0
            },
            "description": "[x, y]，x 向右、y 向下，原点左上"
          },
          "goal": {
            "type": "array",
            "minItems": 2,
            "maxItems": 2,
            "items": {
              "type": "integer",
              "minimum": 0
            },
            "description": "[x, y]，x 向右、y 向下，原点左上"
          },
          "label": {
            "type": "string"
          }
        }
      }
    },
    "objective": {
      "type": "object",
      "additionalProperties": false,
      "required": [
        "kind"
      ],
      "properties": {
        "kind": {
          "enum": [
            "soc",
            "makespan"
          ]
        },
        "direction": {
          "const": "min"
        }
      }
    },
    "solver": {
      "type": "object",
      "additionalProperties": false,
      "properties": {
        "planner": {
          "enum": [
            "auto",
            "ecbs",
            "cbs",
            "pp",
            "prioritized"
          ]
        },
        "time_limit_ms": {
          "type": "integer",
          "minimum": 1,
          "maximum": 900000
        },
        "seed": {
          "type": "integer",
          "minimum": 0
        },
        "suboptimality_factor": {
          "type": "number",
          "minimum": 1.0,
          "maximum": 3.0
        },
        "max_expansions": {
          "type": "integer",
          "minimum": 0
        },
        "warm_start": {
          "type": "boolean"
        },
        "restarts": {
          "type": "integer",
          "minimum": 0
        }
      }
    },
    "benchmark": {
      "type": "object",
      "additionalProperties": false,
      "properties": {
        "source": {
          "type": "string"
        },
        "map_file": {
          "type": "string"
        },
        "scen_file": {
          "type": "string"
        },
        "map_sha256": {
          "type": "string",
          "pattern": "^sha256:[0-9a-f]{64}$"
        },
        "scen_sha256": {
          "type": "string",
          "pattern": "^sha256:[0-9a-f]{64}$"
        },
        "instance_id": {
          "type": "integer",
          "minimum": 0
        },
        "agents": {
          "type": "integer",
          "minimum": 1
        },
        "converter_version": {
          "type": "string"
        },
        "cite": {
          "type": "string"
        },
        "conversion": {
          "type": "string",
          "description": "standard:line#N | additive:first-k-lines"
        }
      }
    },
    "dynamic": {
      "type": "object",
      "additionalProperties": false,
      "required": [
        "snapshot",
        "events"
      ],
      "properties": {
        "snapshot": {
          "type": "object",
          "additionalProperties": false,
          "required": [
            "time"
          ],
          "properties": {
            "time": {
              "type": "integer",
              "minimum": 0
            },
            "frozen_steps": {
              "type": "integer",
              "minimum": 0
            },
            "frozen": {
              "type": "object",
              "additionalProperties": {
                "type": "integer",
                "minimum": 0
              }
            },
            "paths": {
              "type": "object",
              "additionalProperties": {
                "type": "array",
                "items": {
                  "type": "array",
                  "minItems": 2,
                  "maxItems": 2,
                  "items": {
                    "type": "integer",
                    "minimum": 0
                  },
                  "description": "[x, y]，x 向右、y 向下，原点左上"
                }
              }
            },
            "prior_solution_hash": {
              "type": "string"
            },
            "actual_positions": {
              "type": "object",
              "additionalProperties": {
                "type": "array",
                "minItems": 2,
                "maxItems": 2,
                "items": {
                  "type": "integer",
                  "minimum": 0
                },
                "description": "[x, y]，x 向右、y 向下，原点左上"
              }
            }
          }
        },
        "events": {
          "type": "array",
          "items": {
            "type": "object",
            "required": [
              "type",
              "at"
            ],
            "properties": {
              "type": {
                "enum": [
                  "obstacle_add",
                  "obstacle_remove",
                  "path_invalid",
                  "goal_change"
                ]
              },
              "at": {
                "type": "integer",
                "minimum": 0
              },
              "until": {
                "anyOf": [
                  {
                    "type": "integer",
                    "minimum": 0
                  },
                  {
                    "type": "null"
                  }
                ]
              },
              "cell": {
                "type": "array",
                "minItems": 2,
                "maxItems": 2,
                "items": {
                  "type": "integer",
                  "minimum": 0
                },
                "description": "[x, y]，x 向右、y 向下，原点左上"
              },
              "robot": {
                "type": "string",
                "minLength": 1
              },
              "robots": {
                "type": "array",
                "items": {
                  "type": "string",
                  "minLength": 1
                }
              },
              "goal": {
                "type": "array",
                "minItems": 2,
                "maxItems": 2,
                "items": {
                  "type": "integer",
                  "minimum": 0
                },
                "description": "[x, y]，x 向右、y 向下，原点左上"
              }
            }
          }
        }
      }
    },
    "tags": {
      "type": "object"
    },
    "notes": {
      "type": "array",
      "items": {
        "type": "string"
      }
    }
  }
}
