{
  "schema_version": "mapf-problem/1.0",
  "id": "m10-dynamic-events",
  "map": {
    "cells": [
      ".....",
      ".XXX.",
      ".....",
      ".XXX.",
      "....."
    ]
  },
  "time_model": {
    "timestep": "discrete",
    "horizon": 10
  },
  "robots": [
    {
      "id": "AGV-A",
      "start": [
        0,
        0
      ],
      "goal": [
        4,
        0
      ]
    },
    {
      "id": "AGV-B",
      "start": [
        4,
        2
      ],
      "goal": [
        0,
        2
      ]
    },
    {
      "id": "AGV-C",
      "start": [
        0,
        4
      ],
      "goal": [
        4,
        4
      ]
    },
    {
      "id": "AGV-D",
      "start": [
        1,
        2
      ],
      "goal": [
        2,
        0
      ]
    }
  ],
  "objective": {
    "kind": "soc",
    "direction": "min"
  },
  "solver": {
    "planner": "auto",
    "time_limit_ms": 8000,
    "seed": 42,
    "suboptimality_factor": 1.0
  },
  "dynamic": {
    "snapshot": {
      "time": 2,
      "frozen_steps": 1,
      "paths": {
        "AGV-A": [
          [
            0,
            0
          ],
          [
            1,
            0
          ],
          [
            2,
            0
          ],
          [
            3,
            0
          ],
          [
            4,
            0
          ],
          [
            4,
            0
          ],
          [
            4,
            0
          ],
          [
            4,
            0
          ],
          [
            4,
            0
          ],
          [
            4,
            0
          ],
          [
            4,
            0
          ]
        ],
        "AGV-B": [
          [
            4,
            2
          ],
          [
            3,
            2
          ],
          [
            2,
            2
          ],
          [
            1,
            2
          ],
          [
            0,
            2
          ],
          [
            0,
            2
          ],
          [
            0,
            2
          ],
          [
            0,
            2
          ],
          [
            0,
            2
          ],
          [
            0,
            2
          ],
          [
            0,
            2
          ]
        ],
        "AGV-C": [
          [
            0,
            4
          ],
          [
            1,
            4
          ],
          [
            2,
            4
          ],
          [
            3,
            4
          ],
          [
            4,
            4
          ],
          [
            4,
            4
          ],
          [
            4,
            4
          ],
          [
            4,
            4
          ],
          [
            4,
            4
          ],
          [
            4,
            4
          ],
          [
            4,
            4
          ]
        ],
        "AGV-D": [
          [
            1,
            2
          ],
          [
            0,
            2
          ],
          [
            0,
            1
          ],
          [
            0,
            0
          ],
          [
            1,
            0
          ],
          [
            2,
            0
          ],
          [
            2,
            0
          ],
          [
            2,
            0
          ],
          [
            2,
            0
          ],
          [
            2,
            0
          ],
          [
            2,
            0
          ]
        ]
      }
    },
    "events": [
      {
        "type": "obstacle_add",
        "cell": [
          2,
          2
        ],
        "at": 5,
        "until": null
      },
      {
        "type": "goal_change",
        "robot": "AGV-D",
        "goal": [
          3,
          0
        ],
        "at": 2
      },
      {
        "type": "path_invalid",
        "robots": [
          "AGV-A"
        ],
        "at": 2
      }
    ]
  },
  "tags": {
    "name": "M10 动态障碍与目标变化",
    "description": "t=2 快照：新增障碍封锁 (2,2)（t≥5）、AGV-D 改派终点 (2,0)→(3,0)、AGV-A 原路径作废；冻结承诺至 t=3（A 至 t=2）。重规划必须保持全部已执行历史与前缀承诺。",
    "kind": "scenario",
    "expect": "OPTIMAL/FEASIBLE；frozen-prefix 核验通过；affected_agents ≥ 1"
  }
}
