{
  "schema_version": "mapf-problem/1.0",
  "id": "m09-crowded-bottleneck",
  "map": {
    "cells": [
      "#.###.###.###",
      "............#",
      "#............",
      "#...........#",
      "#.....#.....#",
      "............#",
      "#...#.#.#....",
      "#...........#",
      "#.....#.....#",
      "............#",
      "#............",
      "#...........#",
      "##.###.###.##"
    ]
  },
  "time_model": {
    "timestep": "discrete",
    "horizon": "auto"
  },
  "robots": [
    {
      "id": "AGV-01",
      "start": [
        9,
        11
      ],
      "goal": [
        1,
        11
      ]
    },
    {
      "id": "AGV-02",
      "start": [
        4,
        5
      ],
      "goal": [
        0,
        1
      ]
    },
    {
      "id": "AGV-03",
      "start": [
        9,
        1
      ],
      "goal": [
        6,
        1
      ]
    },
    {
      "id": "AGV-04",
      "start": [
        3,
        2
      ],
      "goal": [
        7,
        9
      ]
    },
    {
      "id": "AGV-05",
      "start": [
        2,
        10
      ],
      "goal": [
        8,
        10
      ]
    },
    {
      "id": "AGV-06",
      "start": [
        4,
        3
      ],
      "goal": [
        8,
        9
      ]
    },
    {
      "id": "AGV-07",
      "start": [
        8,
        7
      ],
      "goal": [
        1,
        8
      ]
    },
    {
      "id": "AGV-08",
      "start": [
        5,
        10
      ],
      "goal": [
        5,
        11
      ]
    },
    {
      "id": "AGV-09",
      "start": [
        9,
        4
      ],
      "goal": [
        12,
        6
      ]
    },
    {
      "id": "AGV-10",
      "start": [
        3,
        9
      ],
      "goal": [
        3,
        11
      ]
    },
    {
      "id": "AGV-11",
      "start": [
        10,
        10
      ],
      "goal": [
        5,
        7
      ]
    },
    {
      "id": "AGV-12",
      "start": [
        2,
        6
      ],
      "goal": [
        6,
        2
      ]
    },
    {
      "id": "AGV-13",
      "start": [
        11,
        5
      ],
      "goal": [
        6,
        12
      ]
    },
    {
      "id": "AGV-14",
      "start": [
        2,
        5
      ],
      "goal": [
        11,
        8
      ]
    },
    {
      "id": "AGV-15",
      "start": [
        7,
        6
      ],
      "goal": [
        8,
        2
      ]
    },
    {
      "id": "AGV-16",
      "start": [
        5,
        1
      ],
      "goal": [
        6,
        7
      ]
    },
    {
      "id": "AGV-17",
      "start": [
        7,
        2
      ],
      "goal": [
        1,
        9
      ]
    },
    {
      "id": "AGV-18",
      "start": [
        3,
        10
      ],
      "goal": [
        7,
        10
      ]
    },
    {
      "id": "AGV-19",
      "start": [
        6,
        5
      ],
      "goal": [
        1,
        7
      ]
    },
    {
      "id": "AGV-20",
      "start": [
        12,
        2
      ],
      "goal": [
        0,
        9
      ]
    },
    {
      "id": "AGV-21",
      "start": [
        6,
        11
      ],
      "goal": [
        9,
        7
      ]
    },
    {
      "id": "AGV-22",
      "start": [
        7,
        5
      ],
      "goal": [
        8,
        5
      ]
    },
    {
      "id": "AGV-23",
      "start": [
        4,
        10
      ],
      "goal": [
        11,
        1
      ]
    },
    {
      "id": "AGV-24",
      "start": [
        8,
        4
      ],
      "goal": [
        5,
        0
      ]
    }
  ],
  "objective": {
    "kind": "soc",
    "direction": "min"
  },
  "solver": {
    "planner": "auto",
    "time_limit_ms": 10000,
    "seed": 42,
    "suboptimality_factor": 1.5
  },
  "tags": {
    "name": "M09 20+ 车竞争瓶颈",
    "description": "13×13 十字瓶颈墙 + 24 台车强竞争（含对穿/环形流向）：w=1.5、10 秒预算内全部输出合法方案并通过独立核验。",
    "kind": "scenario",
    "expect": "OPTIMAL/FEASIBLE 全部合法，verified=true"
  }
}
